,position,company,city,compensation_min,compensation_max,compensation_currency
0,Data Scientist,ООО Цифроматика,"Санкт-Петербург, Площадь Восстания",200000.0,,RUB
1,Data Scientist (NLP), M-soft,Киев,3000.0,4000.0,RUB
2,Data Scientist (NLP), M-soft,Минск,3000.0,4000.0,RUB
3,Data Scientist / Machine Learning Developer, CoolRocket Team,Новосибирск,,,
4,Аналитик данных / Data Scientist, Открытые Технологии,Москва,120000.0,180000.0,RUB
5,Data Scientist," Wargaming, Minsk (Game Stream)","Минск, Могилевская",,,
6,Data Scientist, Samsung Research Center,"Москва, Савеловская",,,
7,Data Scientist, Червоний маркет,"Киев, Берестейская",30000.0,,RUB
8,Data Scientist,ОАО Оммет,Омск,,,
9,Data scientist,ООО РУСАЛ-Центр учета,Красноярск,,,
10,ML Engineer / Data Scientist, FUSION CORE,"Москва, Сокол",,,
11,"Ведущий специалист / data scientist (big data, прогностическая аналитика, data mining)",ЗАО Прогностические решения,"Москва, Кузнецкий мост",150000.0,,RUB
12,Data Scientist (NLP), GlobalCareer,Москва,,,
13,Разработчик нейронных сетей (data scientist), Лаборатория НТР,Москва,,,
14,Data Scientist (Академгородок),ООО ЭЛСИ ГРУПП,Новосибирск,,,
15,Junior Data scientist,ООО МФК Займ Онлайн,"Москва, Динамо и еще 1 ",,,
16,Data scientist / Специалист машинного обучения, Банк ВТБ (ПАО),Москва,,,
17,Computer Vision / Data scientist CV, DeLight Group,Москва,,,
18,Руководитель направления по исследованию данных(Data Scientist), Сбербанк для экспертов,Москва,,,
19,Junior data analyst (Graduate Program), ИБМ Восточная Европа/Азия - IBM EE/A,Москва,,,
20,Junior data scientist, Сбербанк для экспертов,Москва,,,
21,Аналитик BI / Data scientist, FBS Inc.,Санкт-Петербург,,,
22,Data Scientist, COMPAREX,"Москва, Парк Победы",250000.0,,RUB
23,"Data Scientist, Machine Learning Engineer",ООО Квантидеск,Москва,,,
24,Data Scientist, Сбербанк для экспертов,"Москва, Кутузовская и еще 1 ",,,
25,Data scientist (NLP), Сбербанк для экспертов,"Москва, Новослободская",,,
26,Data Scientist," Лента, федеральная розничная сеть, Офис","Санкт-Петербург, Старая Деревня",,,
27,Data Analyst / Data Scientist, МодульБанк,"Москва, Дмитровская",180000.0,,RUB
28,Data scientist - engineer: Machine Learning/ Analytics/ Advanced Statistics, Sensoleak LTD,Москва,,,
29,Аналитик недвижимости/специалист по работе с данными/data scientist, Пульс Продаж Новостроек,Москва,,,
30,Исследователь данных / Data Scientist / Аналитик,ООО ДДОС ГВАРД,Ростов-на-Дону,,,
31,Junior Data scientist/ Middle data scientist,ООО ИК СИБИНТЕК,"Москва, Беговая",,,
32,Data Scientist / Analyst, ПАО «КАМАЗ»,Набережные Челны,,,
33,Data Scientist, HEINEKEN Russia,Санкт-Петербург,,,
34,Data analyst, Сбербанк для экспертов,Санкт-Петербург,,,
35,Senior Data Scientist,ООО ЗубрСофт,"Минск, Пушкинская",,,
36,Data Scientist," МАГНИТ, Розничная сеть",Краснодар,,,
37,NLP engineer / Data scientist NLP,ООО АлгоМост,"Москва, Маяковская",100000.0,250000.0,RUB
38,Data Scientist, Getintent,"Москва, Курская",,,
39,Data Scientist (г.Краснодар)," МАГНИТ, Розничная сеть",Санкт-Петербург,,,
40,Data scientist/ Директор Центр больших данных и моделирования, Банк ВТБ (ПАО),"Москва, Выставочная",,,
41,Data scientist, Билайн,Москва,,,
42,Инженер-аналитик по машинному обучению (Data Scientist),ООО Фабрика Цифровой Трансформации,Москва,,,
43,Data Scientist, Сбербанк для экспертов,Москва,,,
44,Junior Data Scientist, Plarium,Краснодар,,,
45,Data Scientist,ООО Лайфтех,Минск,,,
46,Data scientist / Специалист машинного обучения, Банк ВТБ (ПАО),Москва,,,
47,Computer Vision / Data scientist CV, DeLight Group,Москва,,,
48,Руководитель направления по исследованию данных(Data Scientist), Сбербанк для экспертов,Москва,,,
49,Junior data analyst (Graduate Program), ИБМ Восточная Европа/Азия - IBM EE/A,Москва,,,
50,Junior data scientist, Сбербанк для экспертов,Москва,,,
51,Аналитик BI / Data scientist, FBS Inc.,Санкт-Петербург,,,
52,Data Scientist, COMPAREX,"Москва, Парк Победы",250000.0,,RUB
53,"Data Scientist, Machine Learning Engineer",ООО Квантидеск,Москва,,,
54,Data Scientist, Сбербанк для экспертов,"Москва, Кутузовская и еще 1 ",,,
55,Data scientist (NLP), Сбербанк для экспертов,"Москва, Новослободская",,,
56,Data Scientist," Лента, федеральная розничная сеть, Офис","Санкт-Петербург, Старая Деревня",,,
57,Data Analyst / Data Scientist, МодульБанк,"Москва, Дмитровская",180000.0,,RUB
58,Data scientist - engineer: Machine Learning/ Analytics/ Advanced Statistics, Sensoleak LTD,Москва,,,
59,Аналитик недвижимости/специалист по работе с данными/data scientist, Пульс Продаж Новостроек,Москва,,,
60,Исследователь данных / Data Scientist / Аналитик,ООО ДДОС ГВАРД,Ростов-на-Дону,,,
61,Junior Data scientist/ Middle data scientist,ООО ИК СИБИНТЕК,"Москва, Беговая",,,
62,Data Scientist / Analyst, ПАО «КАМАЗ»,Набережные Челны,,,
63,Data Scientist, HEINEKEN Russia,Санкт-Петербург,,,
64,Data analyst, Сбербанк для экспертов,Санкт-Петербург,,,
65,Senior Data Scientist,ООО ЗубрСофт,"Минск, Пушкинская",,,
66,Data Scientist," МАГНИТ, Розничная сеть",Москва,,,
67,Middle/ Senior Data Scientist (NLP), ЦРТ | Группа компаний,"Санкт-Петербург, Выборгская",,,
68,Middle/ Senior Data scientist (speech recognition), ЦРТ | Группа компаний,Санкт-Петербург,,,
69,Старший аналитик/Data Scientist в продуктовую аналитику," Mail.Ru Group, E-commerce",Москва,,,
70,Data Scientist, JetBrains,"Москва, Белорусская",170000.0,,RUB
71,Big Data developer (Data Science platform)," Mail.Ru Group, Социальные сети, Одноклассники","Москва, Аэропорт",,,
72,Программист-математик (инженер),ЗАО Градиент,Казань,,,
73,Data Scientist (клиентская аналитика),"ПАО МегаФон, Digital",Москва,,,
74,Инженер по обработке данных / Data Engineer, Сбербанк для руководителей,Москва,,,
75,Data Scientist, Сибур,Москва,,,
76,Аналитик данных (SQL), Сбербанк для экспертов,Санкт-Петербург,170000.0,,RUB
77,Аналитик-разработчик (Data Scientist),ООО Джой Колс Групп,Москва,,,
78,"Стажер/Специалист (Data Scientist, Группа улучшения бизнес-технологии и ИТ)", EY (Эрнст энд Янг),"Москва, Павелецкая",,,
79,ML-инженер / Data Scientist, Интерсвязь,Челябинск,35000.0,80000.0,RUB
80,Аналитик SQL / Data Scientist, АльфаСтрахование,"Москва, Шаболовская",,,
81,Data Scientist, OZON.ru Разработка,Москва,,,
82,Data Scientist/Математик-программист, Ай-Теко (I-Teco),Москва,,,
83,Data Scientist (gamedev), Panoramik,"Санкт-Петербург, Василеостровская и еще 1 ",,,
84,Эксперт аналитического центра / Data scientist, Сибирская генерирующая Компания УК,Новосибирск,100000.0,,RUB
85,Специалист по обработке и анализу данных (Data Scientist), ELMA,Киров,100000.0,,RUB
86,Junior Data scientist (Департамент внутреннего аудита)," «РОСБАНК, Societe Generale Group», с опытом работы","Москва, Комсомольская и еще 2 ",,,
87,Специалист по машинному обучению / Data Scientist (FinTech), Университет ИТМО,"Санкт-Петербург, Василеостровская",75000.0,,RUB
88,Data scientist, КОМПЛИТ,"Санкт-Петербург, Старая Деревня",,,
89,Data scientist (SAS), Сбербанк для экспертов,Москва,,,
90,Senior/Middle Data Scientist,"АО Ренессанс здоровье, Страховая компания","Москва, Пролетарская",,,
91,Аналитик данных (Data Scientist),ООО Форпост,Москва,,,
92,Senior Data Scientist в NLP лабораторию СКБ Контур, СКБ Контур,Екатеринбург,,,
93,Разработчик-исследователь в области искусственного интеллекта / Data Scientist, Университет ИТМО,"Санкт-Петербург, Василеостровская",80000.0,,RUB
94,Data Scientist / Machine Learning Developer, Peller.Tech Inc,Москва,,,
95,Data Scientist (Middle), Сбербанк для экспертов,Екатеринбург,,,
96,Data Scientist,АО Рамакс Интернейшнл,"Москва, Павелецкая и еще 2 ",,,
97,Data Analyst / Scientist, Genesis,Киев,,,
98,Python Data Scientist, Neuro.net,Нижний Новгород,100000.0,150000.0,RUB
99,"Programmatic Analyst, Data Scientist for Eastern Europe"," «Procter & Gamble», Молодой специалист",Москва,95000.0,,RUB
100,Data scientist \ аналитик данных," «Почта России», Офис","Москва, Нагатинская и еще 1 ",,,
101,Senior Data Scientist в NLP лабораторию СКБ Контур, СКБ Контур,Санкт-Петербург,,,
102,Senior Data Scientist в NLP лабораторию СКБ Контур, СКБ Контур,Иннополис,,,
103,"Senior Data scientist (NLP, чат бот)", Сбербанк для экспертов,Москва,,,
104,Artificial Intelligence and Data Analytics Scientist, Aramco Innovations,"Москва, Ломоносовский проспект",,,
105,Аналитик/Data Scientist, BORK,Москва,,,
106,Middle data scientist, oneFactor,Москва,,,
107,Data Scientist, МФИ Софт,Нижний Новгород,,,
108,Data Scientist / Machine Learning Engineer,ООО АЛИБАБА.КОМ (РУ),Москва,,,
109,Преподаватель курса Анализ данных на Python, Nordic IT School,"Москва, Комсомольская и еще 2 ",,,
110,Senior Data Scientist, Spice Agency,Москва,,,
111,Специалист по обработке и анализу данных (Data Scientist), ELMA,Ижевск,100000.0,,RUB
112,Data Scientist,ТОО Business and Technology Services,Нур-Султан,,,
113,Data Scientist, Align Technology,"Москва, Тульская",,,
114,Data Scientist,АО Фармасинтез,Москва,100000.0,,RUB
115,Data scientist, Сбербанк для экспертов,Екатеринбург,,,
116,Data scientist (Нижний Новгород), ANCOR FinTech,Краснодар,,,
117,Data Scientist (Marketing Research & Analytics), JetBrains,"Санкт-Петербург, Новокрестовская и еще 1 ",,,
118,Junior Data Scientist," EPAM Systems, Inc.",Нижний Новгород,,,
119,Data scientist, Авито,Москва,,,
120,Senior Nutrition Scientist (Russia & BUCCA),ООО PepsiCo,"Москва, Сокол",,,
121,Data Scientist,ООО Расберри Ру,Нижний Новгород,,,
122,Senior Data Scientist, Сбербанк для экспертов,Екатеринбург,,,
123,Data scientist / quant analyst, Recruitment Boutique S.M.Art,Москва,,,
124,Python developer (Data Engineer), Admitad,"Москва, Дмитровская",,,
125,Исследователь данных (Data Scientist), IBS,Санкт-Петербург,,,
126,Data Scientist (Старший аудитор), Сбербанк для экспертов,Москва,,,
127,Data Scientist/Аналитик Data Science, Social Discovery Ventures,"Москва, Динамо",,,
128,Специалист по анализу данных (Data Scientist) г. Сочи, Отраслевой центр разработок и внедрения информационных систем / ОЦРВ,Нижний Новгород,110000.0,150000.0,RUB
129,Специалист по анализу данных (Data Scientist) г. Сочи, Отраслевой центр разработок и внедрения информационных систем / ОЦРВ,Казань,110000.0,150000.0,RUB
130,Data Scientist,АО Рамакс Интернейшнл,"Москва, Павелецкая и еще 2 ",,,
131,Специалист по анализу данных (Data Scientist) г. Сочи, Отраслевой центр разработок и внедрения информационных систем / ОЦРВ,Краснодар,110000.0,150000.0,RUB
132,Специалист по анализу данных (Data Scientist) г. Сочи, Отраслевой центр разработок и внедрения информационных систем / ОЦРВ,Новосибирск,110000.0,150000.0,RUB
133,Специалист по анализу данных (Data Scientist) г. Сочи, Отраслевой центр разработок и внедрения информационных систем / ОЦРВ,Москва,110000.0,150000.0,RUB
134,Специалист по анализу данных (Data Scientist) г. Сочи, Отраслевой центр разработок и внедрения информационных систем / ОЦРВ,Екатеринбург,110000.0,150000.0,RUB
135,Специалист по анализу данных (Data Scientist) г. Сочи, Отраслевой центр разработок и внедрения информационных систем / ОЦРВ,Санкт-Петербург,110000.0,150000.0,RUB
136,Data scientist,ООО Специальный Технологический Центр,Санкт-Петербург,,,
137,Data Scientist, Сбербанк для экспертов,Пермь,,,
138,"Data scientist (ML разработчик, python)", Mindbox,"Москва, Белорусская и еще 1 ",140000.0,170000.0,RUB
139,Data scientist,ООО Тувэтрейд Технолоджи,"Москва, Новокузнецкая",,,
140,Data Scientist, Кадровое Агентство Уникальных Специалистов,"Москва, Технопарк",150000.0,,RUB
141,Data Scientist( NLP), Сбербанк для экспертов,Москва,,,
142,Исследователь в области машинного обучения и анализа данных, Университет ИТМО,"Санкт-Петербург, Василеостровская",100000.0,,RUB
143,Ведущий исследователь данных (NLP), Сбербанк для экспертов,Москва,,,
144,Data engineer, Lamoda,Москва,,,
145,Geo and Petrophysical Instrumentation Scientist, Aramco Innovations,"Москва, Ломоносовский проспект",,,
146,Senior Data Scientist в NLP лабораторию СКБ Контур, СКБ Контур,Москва,,,
147,Ведущий data scientist, Деловые Линии,"Санкт-Петербург, Звёздная и еще 2 ",,,
148,"Data scientist (ML-разработчик, python)", Star-staff,"Москва, Савеловская",150000.0,,RUB
149,Senior Data Scientist,АО Рамакс Интернейшнл,"Москва, Павелецкая и еще 2 ",,,
150,Junior Data Scientist (математик-программист), Nicotech International,"Москва, Свиблово",,,
151,Специалист по машинному обучению/Data Scientist (NLP), Университет ИТМО,"Санкт-Петербург, Василеостровская",,,
152,Data scientist,"ПАО МегаФон, IT",Екатеринбург,,,
153,Data Scientist, Сбербанк для экспертов,Санкт-Петербург,,,
154,Data Scientist/Data Statistician,АО Citibank,Москва,,,
155,"Data Scientist, Voice Recognition (Маруся)"," Mail.Ru Group, Другое",Москва,,,
156,R&D Senior Scientist (Discovery & Applications),ООО PepsiCo,"Москва, Сокол",,,
157,Data Scientist (Дивизион `Забота о клиентах` ), Сбербанк для экспертов,Москва,,,
158,Senior Data Scientist, Леруа Мерлен. Центральный офис,"Москва, Шаболовская",,,
159,Data Scientist отдела аудита информационных технологий, Сбербанк для экспертов,Санкт-Петербург,,,
160,Исследователь данных (Data Scientist), IBS,Нижний Новгород,,,
161,Data Scientist,ООО Агентство ПРОФИ,Сочи,150000.0,,RUB
162,Senior Data scientist, ANCOR FinTech,Нижний Новгород,,,
163,Deep Learning Scientist (Neural NLP/TTS/ASR),АО РБ Текнолоджи,"Москва, Парк культуры",,,
164,Data Scientist/Программист Computer Vision, Ай-Теко (I-Teco),Москва,,,
165,Data Scientist,ООО Изибрэйн,"Минск, Молодежная",,,
166,Data Scientist (г.Краснодар)," МАГНИТ, Розничная сеть",Таганрог,,,
167,Data Scientist (NLP), M-soft,Санкт-Петербург,3000.0,4000.0,RUB
168,Product Analyst / Data Analyst, Туту.ру,"Москва, Нагатинская",,,
169,Data Scientist (г.Краснодар)," МАГНИТ, Розничная сеть",Новосибирск,,,
170,Senior data scientist, Vodafone Украина,"Киев, Печерская",,,
171,Data Scientist,ООО Ак Барс Цифровые Технологии,"Казань, Козья слобода",,,
172,Data Scientist, ЛАНИТ-ТЕХНОЛОГИИ,Новосибирск,,,
173,Data scientist, Noveo,Москва,,,
174,Data Scientist, Plarium,Краснодар,,,
175,Imaging Scientist/Научный программист, InterJob (Анташкевич И. О.),Москва,,,
176,Data scientist (NLP/NLU), ДомКлик,Москва,,,
177,Data Scientist / Machine Learning Developer, ANY.RUN,Ульяновск,,,
178,Senior Data Scientist, QIWI,"Москва, Чертановская",,,
179,Data scientist, AD.RU,"Москва, Новокузнецкая",,,
180,Data Science, Grid Dynamics,Нижний Новгород,,,
181,Аналитик, Photo Lab,"Москва, Тверская и еще 2 ",100000.0,200000.0,RUB
182,Data Scientist/Machine Learn developer, Консорциум Кодекс,Санкт-Петербург,130000.0,,RUB
183,Data Scientist, Qlean,"Москва, Савеловская",,,
184,Senior data scientist, Билайн,Москва,,,
185,Data Scientist / Machine Learning Engineer ( на Кипр ), Wisebits,Москва,,,
186,Ведущий бизнес-аналитик,ООО Цифроматика,"Москва, Курская и еще 2 ",200000.0,,RUB
187,Head of QA for a Swiss AI Startup, Assaia International AG,Санкт-Петербург,3000.0,4300.0,RUB
188,IT рекрутер, OZON.ru интернет-витрина,"Москва, Деловой центр и еще 2 ",,,
189,Middle/Senior ML-инженер в Контур.Фокус, СКБ Контур,Иннополис,,,
190,Golang разработчик,ООО Специальный Технологический Центр,Санкт-Петербург,,,
191,Middle/Senior ML-инженер в Контур.Фокус, СКБ Контур,Екатеринбург,,,
192,Системный аналитик / Чат-бот, Банк Хоум Кредит,"Москва, Белорусская",100000.0,160000.0,RUB
193,Главный аналитик (CRM аналитика), Альфа-Банк,"Москва, Технопарк",,,
194,Ведущий инженер машинного обучения,ООО Газпром-медиа Развлекательное телевидение (ГПМ РТВ),"Москва, Маяковская",,,
195,Python Developer, NOVARDIS,Санкт-Петербург,,,
196,Руководитель направления/ Аналитик (Клиентская Аналитика),ПАО МТС Банк,"Москва, Технопарк",,,
197,Системный аналитик (ETL/DWH), Техносерв Консалтинг,"Москва, Автозаводская",,,
198,Support/Monitoring Engineer for a Swiss AI Startup, Assaia International AG,Санкт-Петербург,2000.0,3000.0,RUB
199,Senior Java Developer, Сбербанк для экспертов,Самара,,,
200,"Sales Development Representative (Customer-Facing, English)", DataRobot,Минск,,,
201,Middle Go Developer (GKT Team), SEMrush,Санкт-Петербург,,,
202,Middle Go Developer (GKT Team), SEMrush,Новосибирск,,,
203,Руководитель отдела технического пресейла (IT/IoT/автоматизация), Tibbo,Москва,,,
204,Head Of Growth Marketing,ООО МЕЛ Саенс,Санкт-Петербург,,,
205,Старший аналитик (ML), Инфосистемы Джет,"Москва, Савеловская",,,
206,Solution Software Architect, Luxoft,Санкт-Петербург,,,
207,AI/ML Engineer, Netcracker Technology Corp.,Воронеж,,,
208,Python Engineer (AI API), DataRobot,Минск,,,
209,Senior Java Developer, Сбербанк для экспертов,Самара,,,
210,Бизнес-аналитик клиентской базы,"ПАО МегаФон, IT",Москва,,,
211,Руководитель группы Data Analytics, GDC (ICL Services),Казань,,,
212,Technical lead R&D, IPONWEB Ltd (UK),Москва,,,
213,Business Analyst/Product Manager,ООО Перфект Арт,Москва,,,
214,Incident Manager - GFN, NVIDIA,"Москва, Марьина Роща и еще 1 ",,,
215,Senior Back-end Developer,ООО Globus.ai,Норвегия,,,
216,ETL-разработчик," Mail.Ru Group, E-commerce","Москва, Аэропорт",,,
217,Project Manager, The Ad Masters,"Киев, Печерская",,,
218,Старший Golang разработчик,ООО Специальный Технологический Центр,Санкт-Петербург,,,
219,Senior Back End Developer for Keywee (Minsk), Ciklum,Минск,,,
220,Lead React.js Engineer, Quantori,Санкт-Петербург,,,
221,Ad Operations Manager (Programmatic Sales), AdMe,Москва,,,
222,Ad Operations Manager (Programmatic Sales), AdMe,Санкт-Петербург,,,
223,Ad Operations Manager (Programmatic Sales), AdMe,Кипр,,,
224,Архитектор BigData DWH," Mail.Ru Group, Решения для бизнеса","Москва, Аэропорт",,,
225,DevOps Engineer for an AI Swiss Startup, Assaia International AG,Санкт-Петербург,2500.0,3500.0,RUB
226,Facebook Ads Manager, DELVE,"Минск, Площадь Ленина",,,
227,Technical Recruiter (Recruiting),ООО МэпДэйта,Минск,,,
228,System Engineer, VisiQuate,Харьков,,,
